{
  "schema": "ewoh:///repository-facts/v1",
  "generatedAt": "2026-08-04T18:45:33.614Z",
  "head": "6e6a67f0c3e6bbe74082ba960267d070722b59c7",
  "branch": "main",
  "version": "0.6.0-rc4",
  "testCounts": {
    "serverJest": "81 suites / 391 tests",
    "clientJest": "15 suites / 50 tests",
    "openapi": "248/248",
    "e2e": "33/33",
    "browser": "5/5",
    "evidence": 110
  },
  "evidence": {
    "total": 110,
    "incomplete": 0,
    "expired": 0,
    "missingCommitSha": 0
  },
  "workGraph": {
    "items": 0,
    "edges": 0,
    "actors": 0,
    "evidence": 0,
    "gates": 0,
    "conflicts": 0
  },
  "openapi": {
    "controller": 253,
    "spec": 253,
    "unimplemented": 0
  },
  "database": {
    "managedTables": 51,
    "physicalTables": 57
  },
  "checks": []
}
